{
  "version": "1.1.0",
  "last_updated": "2026-10-23",
  "status": "rascunho",
  "route": "/privacidade",
  "page_title": "Privacidade e Termos de Uso",
  "controller": {
    "corporate_name": "Souza Guedes Advogados",
    "oab_registration": "511.204/SP e 538.416/SP",
    "address": "Rua Uhland, 784, Casa 1, Vila Ema, São Paulo/SP, CEP 03283-000",
    "email": "souzaguedes.adv@gmail.com"
  },
  "data_protection_officer": {
    "name": "Lays Regina de Souza",
    "oab_number": "OAB/SP nº 511.204",
    "email": "souzaguedes.adv@gmail.com",
    "email_subject": "LGPD"
  },
  "retention": {
    "contact_without_engagement_months": 12,
    "access_logs_months": 6
  },
  "privacy_policy": {
    "title": "Política de Privacidade",
    "sections": [
      {
        "heading": "1. Quem é responsável pelos seus dados",
        "paragraphs": [
          "Esta política explica como a Souza Guedes Advogados trata os dados pessoais de quem usa este site ou entra em contato com o escritório pelos canais oficiais. Ela segue a Lei Geral de Proteção de Dados Pessoais (LGPD, Lei nº 13.709/2018).",
          "O controlador dos dados é a Souza Guedes Advogados, com sede na Rua Uhland, 784, Casa 1, Vila Ema, São Paulo/SP, CEP 03283-000. A encarregada pelo tratamento de dados pessoais é a advogada Lays Regina de Souza, OAB/SP nº 511.204, que atende pelo e-mail souzaguedes.adv@gmail.com, com o assunto \"LGPD\"."
        ],
        "list": [],
        "closing_paragraphs": []
      },
      {
        "heading": "2. Quais dados tratamos",
        "paragraphs": [
          "Tratamos apenas os dados necessários para responder a quem nos procura:"
        ],
        "list": [
          "Formulário de contato: nome, e-mail, telefone (opcional), área de interesse e a mensagem que você escrever.",
          "Contato direto por e-mail, telefone ou WhatsApp: os dados que você nos enviar nesses canais, como nome, número de telefone, endereço de e-mail e o conteúdo da conversa.",
          "Registros técnicos de acesso: endereço IP, data e hora de acesso e informações do navegador, gerados automaticamente pelo servidor que hospeda o site."
        ],
        "closing_paragraphs": []
      },
      {
        "heading": "3. Para que usamos os dados e com qual base legal",
        "paragraphs": [
          "Cada uso tem uma finalidade e uma base legal prevista no art. 7º da LGPD:"
        ],
        "list": [],
        "closing_paragraphs": [
          "Não usamos os seus dados para publicidade, não os vendemos e não montamos perfis de navegação."
        ],
        "table": {
          "columns": [
            "Finalidade",
            "Dados",
            "Base legal"
          ],
          "rows": [
            [
              "Responder ao seu contato, entender a sua demanda e agendar atendimento",
              "Nome, e-mail, telefone, área de interesse e mensagem",
              "Procedimentos preliminares relacionados a contrato, a pedido do titular (art. 7º, V)"
            ],
            [
              "Guardar o histórico do contato pelo prazo da seção 6, para dar continuidade ao atendimento",
              "Os mesmos dados do contato",
              "Procedimentos preliminares relacionados a contrato, a pedido do titular (art. 7º, V)"
            ],
            [
              "Manter o site seguro e funcionando",
              "Registros técnicos de acesso",
              "Legítimo interesse do controlador (art. 7º, IX)"
            ],
            [
              "Cumprir obrigação legal ou atender a ordem de autoridade competente",
              "Os dados necessários em cada caso",
              "Cumprimento de obrigação legal ou regulatória (art. 7º, II)"
            ],
            [
              "Defender direitos do escritório em processo judicial, administrativo ou arbitral",
              "Os dados necessários em cada caso",
              "Exercício regular de direitos (art. 7º, VI)"
            ]
          ]
        }
      },
      {
        "heading": "4. Não envie dados sensíveis pelo formulário",
        "paragraphs": [
          "O primeiro contato serve para apresentação e para que você exponha a sua demanda de forma resumida. Pedimos que não envie documentos nem dados pessoais sensíveis, como informações de saúde, por esse canal. Se a demanda exigir esses dados, eles serão tratados depois, no atendimento, com a base legal adequada (art. 11 da LGPD)."
        ],
        "list": [],
        "closing_paragraphs": []
      },
      {
        "heading": "5. Com quem os dados são compartilhados",
        "paragraphs": [
          "Os dados ficam com o escritório. Eles só passam por terceiros na medida necessária para o funcionamento dos canais de contato:"
        ],
        "list": [
          "Provedor de e-mail: as mensagens do formulário e os e-mails chegam à caixa institucional do escritório, mantida no Gmail, serviço da Google.",
          "Provedor de hospedagem do site, que armazena os registros técnicos de acesso.",
          "Google Fonts, serviço da Google que fornece as fontes do site: ao carregar uma página, o navegador solicita as fontes aos servidores da Google, que recebem o endereço IP e as informações do navegador de quem visita.",
          "Autoridades públicas, quando houver obrigação legal ou ordem judicial."
        ],
        "closing_paragraphs": [
          "Quem usa o WhatsApp para falar com o escritório também se sujeita aos termos e à política de privacidade do aplicativo."
        ]
      },
      {
        "heading": "6. Por quanto tempo guardamos os dados",
        "paragraphs": [],
        "list": [
          "Mensagens e dados de contato que não resultam em contratação: 12 meses a partir do último contato. Depois disso, são eliminados.",
          "Dados de quem se torna cliente: passam a seguir o contrato de prestação de serviços, os prazos legais aplicáveis e o dever de sigilo profissional.",
          "Registros técnicos de acesso: 6 meses, o mesmo prazo previsto no art. 15 do Marco Civil da Internet (Lei nº 12.965/2014)."
        ],
        "closing_paragraphs": [
          "A guarda por mais tempo só acontece nas hipóteses do art. 16 da LGPD, como o cumprimento de obrigação legal."
        ]
      },
      {
        "heading": "7. Sigilo profissional",
        "paragraphs": [
          "Além da LGPD, as informações trazidas ao escritório estão protegidas pelo sigilo profissional do advogado, previsto no Estatuto da Advocacia (Lei nº 8.906/1994, art. 7º, II) e no Código de Ética e Disciplina da OAB (arts. 35 e 36). O sigilo é de ordem pública e não depende de pedido de quem nos procura."
        ],
        "list": [],
        "closing_paragraphs": []
      },
      {
        "heading": "8. Segurança",
        "paragraphs": [
          "Adotamos medidas técnicas e administrativas para proteger os dados contra acessos não autorizados e contra perda, alteração ou divulgação indevida, como o acesso restrito aos sócios e a conexão segura (HTTPS) no site. Se ocorrer um incidente de segurança que possa causar risco ou dano relevante, o escritório comunicará a Autoridade Nacional de Proteção de Dados (ANPD) e as pessoas afetadas, como prevê o art. 48 da LGPD."
        ],
        "list": [],
        "closing_paragraphs": []
      },
      {
        "heading": "9. Seus direitos",
        "paragraphs": [
          "Pelo art. 18 da LGPD, você pode pedir ao escritório, a qualquer momento:"
        ],
        "list": [
          "confirmação de que tratamos dados seus;",
          "acesso aos dados;",
          "correção de dados incompletos, inexatos ou desatualizados;",
          "anonimização, bloqueio ou eliminação de dados desnecessários, excessivos ou tratados em desconformidade com a lei;",
          "portabilidade dos dados a outro fornecedor de serviço, nos termos da regulamentação da ANPD;",
          "eliminação dos dados tratados com o seu consentimento, salvo nas hipóteses do art. 16 da LGPD;",
          "informação sobre as entidades públicas e privadas com as quais compartilhamos dados;",
          "informação sobre a possibilidade de não fornecer consentimento e sobre as consequências da negativa;",
          "revogação do consentimento."
        ],
        "closing_paragraphs": [
          "Você também pode se opor a um tratamento feito sem consentimento, se ele descumprir a lei, e apresentar reclamação à ANPD."
        ]
      },
      {
        "heading": "10. Como exercer seus direitos",
        "paragraphs": [
          "Envie o pedido para souzaguedes.adv@gmail.com, com o assunto \"LGPD\". A encarregada Lays Regina de Souza responde pelo mesmo canal. Pedidos de confirmação ou de acesso em formato completo são respondidos em até 15 dias, como prevê o art. 19, II, da LGPD. O atendimento não tem custo para o titular.",
          "Para proteger os seus dados, podemos pedir informações que confirmem a sua identidade antes de atender ao pedido."
        ],
        "list": [],
        "closing_paragraphs": []
      },
      {
        "heading": "11. Alterações desta política",
        "paragraphs": [
          "Esta política pode ser atualizada quando o site ou a forma de tratamento dos dados mudar. A data da versão em vigor fica no topo desta página."
        ],
        "list": [],
        "closing_paragraphs": []
      }
    ]
  },
  "cookie_policy": {
    "title": "Política de Cookies",
    "cookie_categories_in_use": [
      "estritamente_necessarios"
    ],
    "sections": [
      {
        "heading": "1. O que são cookies",
        "paragraphs": [
          "Cookies são pequenos arquivos que um site grava no navegador de quem o visita, para lembrar informações entre uma página e outra."
        ],
        "list": [],
        "closing_paragraphs": []
      },
      {
        "heading": "2. Cookies usados neste site",
        "paragraphs": [